<ratings xmlns:xsi="http://www.w3.org/2001/XMLSchema-instance" xsi:noNamespaceSchemaLocation="https://www.hec.usace.army.mil/xmlSchema/cwms/Ratings.xsd">
  <rating-template office-id="SWT">
    <parameters-id>Stage;Flow</parameters-id>
    <version>USGS-Production</version>
    <ind-parameter-specs>
      <ind-parameter-spec position="1">
        <parameter>Stage</parameter>
        <in-range-method>LINEAR</in-range-method>
        <out-range-low-method>NULL</out-range-low-method>
        <out-range-high-method>NULL</out-range-high-method>
      </ind-parameter-spec>
    </ind-parameter-specs>
    <dep-parameter>Flow</dep-parameter>
    <description>Production Stage;Flow rating using USGS ratings</description>
  </rating-template>
  <rating-spec office-id="SWT">
    <rating-spec-id>HASK.Stage;Flow.USGS-Production.USGS</rating-spec-id>
    <template-id>Stage;Flow.USGS-Production</template-id>
    <location-id>HASK</location-id>
    <version>USGS</version>
    <source-agency/>
    <in-range-method>LINEAR</in-range-method>
    <out-range-low-method>NULL</out-range-low-method>
    <out-range-high-method>PREVIOUS</out-range-high-method>
    <active>true</active>
    <auto-update>true</auto-update>
    <auto-activate>true</auto-activate>
    <auto-migrate-extension>false</auto-migrate-extension>
    <ind-rounding-specs>
      <ind-rounding-spec position="1">4444444444</ind-rounding-spec>
    </ind-rounding-specs>
    <dep-rounding-spec>4444444444</dep-rounding-spec>
    <description>HASK Production Stage;Flow rating using USGS ratings</description>
  </rating-spec>
  <virtual-rating office-id="SWT">
    <rating-spec-id>HASK.Stage;Flow.USGS-Production.USGS</rating-spec-id>
    <effective-date>2019-05-06T08:20:00Z</effective-date>
    <create-date>2020-05-13T12:24:34Z</create-date>
    <active>true</active>
    <description/>
    <connections>R2I1=I1,R2I2=R1D,R3I1=R2D</connections>
    <source-ratings>
      <source-rating position="1">
        <rating-spec-id>HASK.Stage;Stage-Correction.USGS-CORR.USGS {ft;ft}</rating-spec-id>
      </source-rating>
      <source-rating position="2">
        <rating-expression>I1 + I2 {ft,ft;ft}</rating-expression>
      </source-rating>
      <source-rating position="3">
        <rating-spec-id>HASK.Stage;Flow.USGS-BASE.USGS {ft;cfs}</rating-spec-id>
      </source-rating>
    </source-ratings>
  </virtual-rating>
</ratings>

