<ratings xmlns:xsi="http://www.w3.org/2001/XMLSchema-instance" xsi:noNamespaceSchemaLocation="https://www.hec.usace.army.mil/xmlSchema/cwms/Ratings.xsd">
  <rating-template office-id="XXX">
    <parameters-id>Elev;Stor</parameters-id>
    <version>Linear</version>
    <ind-parameter-specs>
      <ind-parameter-spec position="1">
        <parameter>Elev</parameter>
        <in-range-method>LINEAR</in-range-method>
        <out-range-low-method>NEAREST</out-range-low-method>
        <out-range-high-method>NEAREST</out-range-high-method>
      </ind-parameter-spec>
    </ind-parameter-specs>
    <dep-parameter>Stor</dep-parameter>
    <description/>
  </rating-template>
  <rating-spec office-id="XXX">
    <rating-spec-id>HEYB.Elev;Stor.Linear.Production</rating-spec-id>
    <template-id>Elev;Stor.Linear</template-id>
    <location-id>HEYB</location-id>
    <version>Production</version>
    <source-agency/>
    <in-range-method>PREVIOUS</in-range-method>
    <out-range-low-method>NEAREST</out-range-low-method>
    <out-range-high-method>PREVIOUS</out-range-high-method>
    <active>true</active>
    <auto-update>false</auto-update>
    <auto-activate>false</auto-activate>
    <auto-migrate-extension>false</auto-migrate-extension>
    <ind-rounding-specs>
      <ind-rounding-spec position="1">4444444444</ind-rounding-spec>
    </ind-rounding-specs>
    <dep-rounding-spec>4444444444</dep-rounding-spec>
    <description>Heyburn Lake Reservoir Storage Capacity Production Rating</description>
  </rating-spec>
  <simple-rating office-id="XXX">
    <rating-spec-id>HEYB.Elev;Stor.Linear.Production</rating-spec-id>
    <vertical-datum-info unit="ft">
      <native-datum>NGVD-29</native-datum>
      <elevation>0</elevation>
      <offset estimate="true">
        <to-datum>NAVD-88</to-datum>
        <value>0.3678</value>
      </offset>
    </vertical-datum-info>
    <units-id vertical-datum="">ft;ac-ft</units-id>
    <effective-date>2015-05-21T19:42:00Z</effective-date>
    <create-date>2012-11-06T17:08:00Z</create-date>
    <active>true</active>
    <description/>
    <rating-points>
      <point>
        <ind>732</ind>
        <dep>0</dep>
      </point>
      <point>
        <ind>732.5</ind>
        <dep>1</dep>
      </point>
      <point>
        <ind>733</ind>
        <dep>2</dep>
      </point>
      <point>
        <ind>733.5</ind>
        <dep>3.5</dep>
      </point>
      <point>
        <ind>734</ind>
        <dep>5</dep>
      </point>
      <point>
        <ind>734.5</ind>
        <dep>7.5</dep>
      </point>
      <point>
        <ind>735</ind>
        <dep>10</dep>
      </point>
      <point>
        <ind>735.5</ind>
        <dep>14.5</dep>
      </point>
      <point>
        <ind>736</ind>
        <dep>19</dep>
      </point>
      <point>
        <ind>736.5</ind>
        <dep>25.5</dep>
      </point>
      <point>
        <ind>737</ind>
        <dep>32</dep>
      </point>
      <point>
        <ind>737.5</ind>
        <dep>41</dep>
      </point>
      <point>
        <ind>738</ind>
        <dep>50</dep>
      </point>
      <point>
        <ind>738.5</ind>
        <dep>62</dep>
      </point>
      <point>
        <ind>739</ind>
        <dep>74</dep>
      </point>
      <point>
        <ind>739.5</ind>
        <dep>89</dep>
      </point>
      <point>
        <ind>740</ind>
        <dep>104</dep>
      </point>
      <point>
        <ind>740.5</ind>
        <dep>123</dep>
      </point>
      <point>
        <ind>741</ind>
        <dep>142</dep>
      </point>
      <point>
        <ind>741.5</ind>
        <dep>165</dep>
      </point>
      <point>
        <ind>742</ind>
        <dep>188</dep>
      </point>
      <point>
        <ind>742.5</ind>
        <dep>217.5</dep>
      </point>
      <point>
        <ind>743</ind>
        <dep>247</dep>
      </point>
      <point>
        <ind>743.5</ind>
        <dep>282.5</dep>
      </point>
      <point>
        <ind>744</ind>
        <dep>318</dep>
      </point>
      <point>
        <ind>744.5</ind>
        <dep>360.5</dep>
      </point>
      <point>
        <ind>745</ind>
        <dep>403</dep>
      </point>
      <point>
        <ind>745.5</ind>
        <dep>452.5</dep>
      </point>
      <point>
        <ind>746</ind>
        <dep>502</dep>
      </point>
      <point>
        <ind>746.5</ind>
        <dep>560</dep>
      </point>
      <point>
        <ind>747</ind>
        <dep>618</dep>
      </point>
      <point>
        <ind>747.5</ind>
        <dep>684.5</dep>
      </point>
      <point>
        <ind>747.75</ind>
        <dep>717.75</dep>
      </point>
      <point>
        <ind>748</ind>
        <dep>751</dep>
      </point>
      <point>
        <ind>748.5</ind>
        <dep>827.5</dep>
      </point>
      <point>
        <ind>749</ind>
        <dep>904</dep>
      </point>
      <point>
        <ind>749.5</ind>
        <dep>990</dep>
      </point>
      <point>
        <ind>750</ind>
        <dep>1076</dep>
      </point>
      <point>
        <ind>750.5</ind>
        <dep>1174</dep>
      </point>
      <point>
        <ind>751</ind>
        <dep>1272</dep>
      </point>
      <point>
        <ind>751.5</ind>
        <dep>1384.5</dep>
      </point>
      <point>
        <ind>752</ind>
        <dep>1497</dep>
      </point>
      <point>
        <ind>752.5</ind>
        <dep>1627</dep>
      </point>
      <point>
        <ind>753</ind>
        <dep>1757</dep>
      </point>
      <point>
        <ind>753.5</ind>
        <dep>1904</dep>
      </point>
      <point>
        <ind>754</ind>
        <dep>2051</dep>
      </point>
      <point>
        <ind>754.5</ind>
        <dep>2104.5</dep>
      </point>
      <point>
        <ind>755</ind>
        <dep>2380</dep>
      </point>
      <point>
        <ind>756</ind>
        <dep>2748</dep>
      </point>
      <point>
        <ind>757</ind>
        <dep>3150</dep>
      </point>
      <point>
        <ind>758</ind>
        <dep>3584</dep>
      </point>
      <point>
        <ind>759</ind>
        <dep>4059</dep>
      </point>
      <point>
        <ind>760</ind>
        <dep>4584</dep>
      </point>
      <point>
        <ind>761</ind>
        <dep>5161</dep>
      </point>
      <point>
        <ind>762</ind>
        <dep>5855</dep>
      </point>
      <point>
        <ind>763</ind>
        <dep>6703</dep>
      </point>
      <point>
        <ind>764</ind>
        <dep>7678</dep>
      </point>
      <point>
        <ind>765</ind>
        <dep>8778</dep>
      </point>
      <point>
        <ind>766</ind>
        <dep>10005</dep>
      </point>
      <point>
        <ind>767</ind>
        <dep>11358</dep>
      </point>
      <point>
        <ind>768</ind>
        <dep>12837</dep>
      </point>
      <point>
        <ind>769</ind>
        <dep>14442</dep>
      </point>
      <point>
        <ind>770</ind>
        <dep>16174</dep>
      </point>
      <point>
        <ind>771</ind>
        <dep>18031</dep>
      </point>
      <point>
        <ind>772</ind>
        <dep>20014</dep>
      </point>
      <point>
        <ind>773</ind>
        <dep>22124</dep>
      </point>
      <point>
        <ind>774</ind>
        <dep>24359</dep>
      </point>
      <point>
        <ind>775</ind>
        <dep>26721</dep>
      </point>
      <point>
        <ind>776</ind>
        <dep>29221</dep>
      </point>
      <point>
        <ind>777</ind>
        <dep>31872</dep>
      </point>
      <point>
        <ind>778</ind>
        <dep>34674</dep>
      </point>
      <point>
        <ind>779</ind>
        <dep>37626</dep>
      </point>
      <point>
        <ind>780</ind>
        <dep>40730</dep>
      </point>
      <point>
        <ind>781</ind>
        <dep>43984</dep>
      </point>
      <point>
        <ind>782</ind>
        <dep>47389</dep>
      </point>
      <point>
        <ind>783</ind>
        <dep>50945</dep>
      </point>
      <point>
        <ind>784</ind>
        <dep>54652</dep>
      </point>
      <point>
        <ind>785</ind>
        <dep>58510</dep>
      </point>
      <point>
        <ind>786</ind>
        <dep>62518</dep>
      </point>
      <point>
        <ind>787</ind>
        <dep>66678</dep>
      </point>
      <point>
        <ind>788</ind>
        <dep>70988</dep>
      </point>
      <point>
        <ind>789</ind>
        <dep>75449</dep>
      </point>
      <point>
        <ind>790</ind>
        <dep>80061</dep>
      </point>
      <point>
        <ind>791</ind>
        <dep>84823</dep>
      </point>
      <point>
        <ind>792</ind>
        <dep>89737</dep>
      </point>
      <point>
        <ind>793</ind>
        <dep>94801</dep>
      </point>
      <point>
        <ind>794</ind>
        <dep>100017</dep>
      </point>
      <point>
        <ind>795</ind>
        <dep>105383</dep>
      </point>
      <point>
        <ind>796</ind>
        <dep>110900</dep>
      </point>
      <point>
        <ind>797</ind>
        <dep>116567</dep>
      </point>
      <point>
        <ind>798</ind>
        <dep>122386</dep>
      </point>
      <point>
        <ind>799</ind>
        <dep>128355</dep>
      </point>
      <point>
        <ind>800</ind>
        <dep>134476</dep>
      </point>
      <point>
        <ind>801</ind>
        <dep>140747</dep>
      </point>
      <point>
        <ind>802</ind>
        <dep>147169</dep>
      </point>
      <point>
        <ind>803</ind>
        <dep>153741</dep>
      </point>
      <point>
        <ind>804</ind>
        <dep>160465</dep>
      </point>
      <point>
        <ind>805</ind>
        <dep>167340</dep>
      </point>
    </rating-points>
  </simple-rating>
</ratings>

