<ratings xmlns:xsi="http://www.w3.org/2001/XMLSchema-instance" xsi:noNamespaceSchemaLocation="https://www.hec.usace.army.mil/xmlSchema/cwms/Ratings.xsd">
  <rating-template office-id="SWT">
    <parameters-id>Stage,Speed-Water Index;Flow</parameters-id>
    <version>Transitional</version>
    <ind-parameter-specs>
      <ind-parameter-spec position="1">
        <parameter>Stage</parameter>
        <in-range-method>LINEAR</in-range-method>
        <out-range-low-method>NULL</out-range-low-method>
        <out-range-high-method>NULL</out-range-high-method>
      </ind-parameter-spec>
      <ind-parameter-spec position="2">
        <parameter>Speed-Water Index</parameter>
        <in-range-method>LINEAR</in-range-method>
        <out-range-low-method>NULL</out-range-low-method>
        <out-range-high-method>NULL</out-range-high-method>
      </ind-parameter-spec>
    </ind-parameter-specs>
    <dep-parameter>Flow</dep-parameter>
    <description/>
  </rating-template>
  <rating-spec office-id="SWT">
    <rating-spec-id>FSMI.Stage,Speed-Water Index;Flow.Transitional.Production</rating-spec-id>
    <template-id>Stage,Speed-Water Index;Flow.Transitional</template-id>
    <location-id>FSMI</location-id>
    <version>Production</version>
    <source-agency>USGS</source-agency>
    <in-range-method>PREVIOUS</in-range-method>
    <out-range-low-method>NEAREST</out-range-low-method>
    <out-range-high-method>PREVIOUS</out-range-high-method>
    <active>true</active>
    <auto-update>false</auto-update>
    <auto-activate>false</auto-activate>
    <auto-migrate-extension>false</auto-migrate-extension>
    <ind-rounding-specs>
      <ind-rounding-spec position="1">4444444444</ind-rounding-spec>
      <ind-rounding-spec position="2">4444444444</ind-rounding-spec>
    </ind-rounding-specs>
    <dep-rounding-spec>4444444444</dep-rounding-spec>
    <description>Transitional rating for transitioning from stage &amp; velocity based rating to straight stage rating</description>
  </rating-spec>
  <transitional-rating office-id="SWT">
    <rating-spec-id>FSMI.Stage,Speed-Water Index;Flow.Transitional.Production</rating-spec-id>
    <units-id>ft,mph;cfs</units-id>
    <effective-date>1900-01-01T06:00:00Z</effective-date>
    <create-date>2017-04-06T18:32:18Z</create-date>
    <active>true</active>
    <description/>
    <select>
      <case position="1">
        <when>I1 GT 25</when>
        <then>R1</then>
      </case>
      <default>R2</default>
    </select>
    <source-ratings>
      <rating-spec-id position="1">FSMI.Stage,Speed-Water Index;Flow.Linear.Dummy</rating-spec-id>
      <rating-spec-id position="2">FSMI.Stage,Speed-Water Index;Flow.Linear.Production</rating-spec-id>
    </source-ratings>
  </transitional-rating>
</ratings>

