<ratings xmlns:xsi="http://www.w3.org/2001/XMLSchema-instance" xsi:noNamespaceSchemaLocation="https://www.hec.usace.army.mil/xmlSchema/cwms/Ratings.xsd">
  <rating-template office-id="XXX">
    <parameters-id>Stage;Flow</parameters-id>
    <version>BASE</version>
    <ind-parameter-specs>
      <ind-parameter-spec position="1">
        <parameter>Stage</parameter>
        <in-range-method>LINEAR</in-range-method>
        <out-range-low-method>NEAREST</out-range-low-method>
        <out-range-high-method>NEAREST</out-range-high-method>
      </ind-parameter-spec>
    </ind-parameter-specs>
    <dep-parameter>Flow</dep-parameter>
    <description/>
  </rating-template>
  <rating-spec office-id="XXX">
    <rating-spec-id>GUTH.Stage;Flow.BASE.PRODUCTION</rating-spec-id>
    <template-id>Stage;Flow.BASE</template-id>
    <location-id>GUTH</location-id>
    <version>PRODUCTION</version>
    <source-agency/>
    <in-range-method>PREVIOUS</in-range-method>
    <out-range-low-method>NEAREST</out-range-low-method>
    <out-range-high-method>PREVIOUS</out-range-high-method>
    <active>true</active>
    <auto-update>true</auto-update>
    <auto-activate>true</auto-activate>
    <auto-migrate-extension>true</auto-migrate-extension>
    <ind-rounding-specs>
      <ind-rounding-spec position="1">4444444444</ind-rounding-spec>
    </ind-rounding-specs>
    <dep-rounding-spec>4444444444</dep-rounding-spec>
    <description>Cimarron River near Guthrie, OK PRODUCTION Stream Rating (Base + Shifts and Offsets)</description>
  </rating-spec>
  <usgs-stream-rating office-id="XXX">
    <rating-spec-id>GUTH.Stage;Flow.BASE.PRODUCTION</rating-spec-id>
    <units-id>ft;cfs</units-id>
    <effective-date>2016-10-11T05:00:00Z</effective-date>
    <create-date>2018-10-15T18:50:00Z</create-date>
    <active>true</active>
    <description>20.0</description>
    <height-offsets>
      <point>
        <ind>0</ind>
        <dep>4.5</dep>
      </point>
      <point>
        <ind>.01</ind>
        <dep>4.5</dep>
      </point>
    </height-offsets>
    <rating-points>
      <point>
        <ind>4.85</ind>
        <dep>2.35</dep>
      </point>
      <point>
        <ind>4.95</ind>
        <dep>5.27</dep>
      </point>
      <point>
        <ind>5.05</ind>
        <dep>10</dep>
      </point>
      <point>
        <ind>5.15</ind>
        <dep>17</dep>
      </point>
      <point>
        <ind>5.3</ind>
        <dep>32</dep>
      </point>
      <point>
        <ind>5.4</ind>
        <dep>45.2</dep>
      </point>
      <point>
        <ind>5.5</ind>
        <dep>61</dep>
      </point>
      <point>
        <ind>5.8</ind>
        <dep>118</dep>
      </point>
      <point>
        <ind>6</ind>
        <dep>168</dep>
      </point>
      <point>
        <ind>7</ind>
        <dep>570</dep>
      </point>
      <point>
        <ind>8</ind>
        <dep>1277</dep>
      </point>
      <point>
        <ind>9</ind>
        <dep>2340</dep>
      </point>
      <point>
        <ind>10</ind>
        <dep>3800</dep>
      </point>
      <point>
        <ind>11</ind>
        <dep>5700</dep>
      </point>
      <point>
        <ind>12.01</ind>
        <dep>7885.04</dep>
      </point>
      <point>
        <ind>13.06</ind>
        <dep>10749.57</dep>
      </point>
      <point>
        <ind>14.86</ind>
        <dep>17052.63</dep>
      </point>
      <point>
        <ind>16.66</ind>
        <dep>24990.04</dep>
      </point>
      <point>
        <ind>18.74</ind>
        <dep>37259.3</dep>
      </point>
      <point>
        <ind>22.83</ind>
        <dep>69967.3</dep>
      </point>
      <point>
        <ind>25.89</ind>
        <dep>105039.8</dep>
      </point>
      <point>
        <ind>31.33</ind>
        <dep>187319.5</dep>
      </point>
    </rating-points>
  </usgs-stream-rating>
</ratings>

